<?xml version="1.0"?>
<PurchaseOrder OrderDate="1999-10-20"
               xmlns="src/com/gmail/olgabovkaniuk/controlWork2/purchaseOrder.xsd"
               xmlns:xsi="http://www.w3.org/2001/XMLSchema-instance"
               xsi:schemaLocation="src/com/gmail/olgabovkaniuk/controlWork2/purchaseOrder.xsd purchaseOrder.xsd">
    <Item PartNumber="872-AA">
        <ProductName>Lawnmower</ProductName>
        <Quantity>1</Quantity>
        <USPrice>148.95</USPrice>
        <Comment>Confirm this is electric</Comment>
    </Item>
    <Item PartNumber="926-AA">
        <ProductName>Baby Monitor</ProductName>
        <Quantity>1</Quantity>
        <USPrice>39.98</USPrice>
        <ShipDate>1999-05-21</ShipDate>
    </Item>
</PurchaseOrder>